{
  "scene_id": "scene_01",
  "genre_guess": "power_growth",
  "scene_function": "conflict",
  "events": [
    {
      "event_id": "evt_01",
      "event_group": "goal_progress",
      "event_type": "suppression_and_reversal",
      "title": "林凡遭围攻后反杀逼退赵虎",
      "description": "林凡在宗门试炼中被赵虎等人突袭围攻，被迫暴露部分隐藏实力，在重伤边缘强行反击，成功逼退赵虎，震惊围观弟子。",
      "participants": [
        "林凡",
        "赵虎",
        "围观弟子"
      ],
      "cause": "赵虎等人早有预谋，在试炼开始时对林凡发动狠辣围攻",
      "consequence": "林凡虽重伤但成功反击，暴露部分底牌，震慑众人并改变其在宗门中的处境",
      "importance_to_main_plot": 1,
      "emotion_value": 1,
      "shock_value": 1,
      "relationship_impact": 1,
      "status_change": true,
      "foreshadowing": false,
      "payoff": true,
      "must_keep": true,
      "can_omit": false
    }
  ]
}