{
  "scene_id": "scene_02",
  "genre_guess": "power_growth",
  "scene_function": "reveal",
  "events": [
    {
      "event_id": "event_01",
      "event_group": "goal_progress",
      "event_type": "revelation.hidden_enemy",
      "title": "林凡识破宗门高层阴谋",
      "description": "林凡察觉周执事纵容赵虎并故意偏袒，意识到幕后黑手是宗门更高层势力，决定主动追查。",
      "participants": [
        "林凡",
        "周执事",
        "赵虎"
      ],
      "cause": "周执事在试炼中不制止赵虎，反而在关键时刻偏袒他。",
      "consequence": "林凡改变被动策略，转为主动调查，将目标从赵虎升级至宗门高层势力。",
      "importance_to_main_plot": 1,
      "emotion_value": 1,
      "shock_value": 1,
      "relationship_impact": 1,
      "status_change": true,
      "foreshadowing": true,
      "payoff": false,
      "must_keep": true,
      "can_omit": false
    }
  ]
}