{
  "scene_id": "scene_02",
  "genre_guess": "power_growth",
  "scene_function": "reveal",
  "events": [
    {
      "event_id": "event_01",
      "event_group": "goal_progress",
      "event_type": "revelation.hidden_enemy",
      "title": "林凡识破宗门高层阴谋",
      "description": "林凡察觉周执事纵容赵虎、刻意偏袒，意识到真正威胁来自宗门内部更高层势力。",
      "participants": [
        "林凡",
        "周执事",
        "赵虎"
      ],
      "cause": "周执事在试炼中不制止赵虎，反而在关键时刻偏袒",
      "consequence": "林凡决定主动追查幕后黑手，从被动防御转为主动出击",
      "importance_to_main_plot": 5,
      "emotion_value": 4,
      "shock_value": 4,
      "relationship_impact": 3,
      "status_change": false,
      "foreshadowing": true,
      "payoff": false,
      "must_keep": true,
      "can_omit": false
    }
  ]
}