{
  "scene_id": "scene_01",
  "genre_guess": "power_growth",
  "scene_function": "conflict",
  "events": [
    {
      "event_id": "event_01",
      "event_group": "revelation",
      "event_type": "power_reveal_under_pressure",
      "title": "林凡试炼遭围攻，重伤反杀逼退赵虎",
      "description": "林凡在宗门试炼中突遭赵虎等人有预谋的围攻，被迫暴露部分隐藏实力，在濒临重伤之际强势反击，成功逼退赵虎，震惊围观弟子。",
      "participants": [
        "林凡",
        "赵虎",
        "围观弟子"
      ],
      "cause": "赵虎等人早有预谋，在试炼开始后立即对林凡发动狠辣围攻",
      "consequence": "林凡暴露部分隐藏实力，虽未彻底击败赵虎，但成功自保并逆转局势，引发众人对其真实实力的重新评估",
      "importance_to_main_plot": 1,
      "emotion_value": 1,
      "shock_value": 1,
      "relationship_impact": 1,
      "status_change": true,
      "foreshadowing": false,
      "payoff": true,
      "must_keep": true,
      "can_omit": false
    }
  ]
}